{
  "schema": "teaching_skill_miner.teacher_agent_skill_library.v2",
  "library_id": "task2_neural_v1_adaptive_teaching_library_v2",
  "name": "neural-v1 自适应多轮教学 Skill Library",
  "version": "2.0.0",
  "derivation": {
    "general_skill_id": "evidence_grounded_multimodal_teaching_neural_v1",
    "source_artifact": "data/neural_v1_runtime_manifest.json",
    "source_status": "model_assisted_neural_v1_provisional_failed_evidence_gate",
    "method": "将 neural-v1 的九环节执行本体与十三项策略本体拆分为实时 Agent 可选择、组合和切换的原子 Skill；研究补充 Skill 单独标源。",
    "claim_boundary": "运行时确实使用 neural-v1 的可执行本体，但该候选的证据物化门禁未通过，因此不能称为已确认的课堂观察共识。"
  },
  "skills": [
    {
      "skill_id": "skill_diagnostic_questioning",
      "name": "前置知识诊断",
      "role": "diagnostic",
      "focus_dimension": "prerequisite",
      "base_priority": 18,
      "applicable_signals": ["not_observed", "confused", "no_response"],
      "supporting_skill_ids": ["skill_wait_and_elicit"],
      "selection_rationale": "先用最小问题确认前置知识，避免按固定教案盲讲。",
      "message_template": "学习 {concept} 前，请用自己的话说出一个必要的前置概念，并举一个最小例子。",
      "expected_signal": "学生能说明前置概念、作用及其与当前目标的联系。",
      "action_type": "probe_prior_knowledge",
      "direct_answer_prohibited": true,
      "execution_contract": {"applicable_when": "首轮或前置知识证据不足", "contraindications": ["前置维度已稳定达标"], "preconditions": ["目标已定义"], "postconditions": ["得到可引用的前置知识证据"], "failure_transition": "skill_retrieval_review", "max_repeat": 2, "addition_reason": "neural-v1 phase 1 的实时包装"},
      "source": {"origin": "operational_wrapper_from_neural_v1_provisional_ontology", "general_skill_id": "evidence_grounded_multimodal_teaching_neural_v1", "source_phase_ids": ["prior_knowledge_review"], "source_strategy_ids": ["question_and_wait"], "observed_status": "provisional_normative_not_observed_consensus"}
    },
    {
      "skill_id": "skill_contextual_problem_setup",
      "name": "问题情境建立",
      "role": "context",
      "focus_dimension": "conceptual",
      "base_priority": 15,
      "applicable_signals": ["correct", "partial", "confused"],
      "supporting_skill_ids": ["skill_wait_and_elicit"],
      "selection_rationale": "把目标放入必须使用该概念才能解释的问题中，形成学习动机和边界。",
      "message_template": "先看一个必须借助 {concept} 才能解释的情境：{example}。你认为真正需要解决的问题是什么？",
      "expected_signal": "学生能复述问题、目标和一个初步猜想。",
      "action_type": "establish_problem_context",
      "direct_answer_prohibited": true,
      "execution_contract": {"applicable_when": "学生具备最低前置知识但尚不理解学习用途", "contraindications": ["已有明确问题表征且当前存在具体误解"], "preconditions": ["有例子或应用情境"], "postconditions": ["学生能复述问题"], "failure_transition": "skill_concrete_example_bridge", "max_repeat": 1, "addition_reason": "补齐 neural-v1 phase 2；旧库缺失该核心环节"},
      "source": {"origin": "operational_wrapper_from_neural_v1_provisional_ontology", "general_skill_id": "evidence_grounded_multimodal_teaching_neural_v1", "source_phase_ids": ["problem_or_context_setup"], "source_strategy_ids": ["concrete_example"], "observed_status": "provisional_normative_not_observed_consensus"}
    },
    {
      "skill_id": "skill_concrete_example_bridge",
      "name": "直观例子桥接",
      "role": "example",
      "focus_dimension": "conceptual",
      "base_priority": 16,
      "applicable_signals": ["confused", "no_response", "partial"],
      "supporting_skill_ids": ["skill_wait_and_elicit", "skill_confidence_support"],
      "selection_rationale": "通过可手算、低负荷的小例子先建立直觉，再进入术语。",
      "message_template": "暂时不背 {concept} 的定义。请观察这个最小例子：{example}。你能指出已知量、目标和重复结构吗？",
      "expected_signal": "学生能用非术语语言指出至少两个关键结构。",
      "action_type": "present_minimal_example",
      "direct_answer_prohibited": true,
      "execution_contract": {"applicable_when": "概念困惑、沉默或只能复述术语", "contraindications": ["当前错误是明确的程序性错误"], "preconditions": ["存在最小例子"], "postconditions": ["形成直观表征"], "failure_transition": "skill_engagement_recovery", "max_repeat": 2, "addition_reason": "neural-v1 phase 3 与 concrete_example 策略"},
      "source": {"origin": "operational_wrapper_from_neural_v1_provisional_ontology", "general_skill_id": "evidence_grounded_multimodal_teaching_neural_v1", "source_phase_ids": ["intuitive_example"], "source_strategy_ids": ["concrete_example", "difficulty_progression"], "observed_status": "provisional_normative_not_observed_consensus"}
    },
    {
      "skill_id": "skill_concept_mapping",
      "name": "直觉—概念映射",
      "role": "concept_mapping",
      "focus_dimension": "conceptual",
      "base_priority": 17,
      "applicable_signals": ["correct", "partial"],
      "supporting_skill_ids": ["skill_wait_and_elicit"],
      "selection_rationale": "将例子要素逐项映射到定义、记号和适用条件。",
      "message_template": "把刚才例子映射到 {concept}：对象、允许的关系和目标分别对应哪里？请解释理由。",
      "expected_signal": "学生能正确完成至少两个要素的形式化映射。",
      "action_type": "map_intuition_to_formalization",
      "direct_answer_prohibited": true,
      "execution_contract": {"applicable_when": "已有直观但形式化表述不稳", "contraindications": ["尚未形成任何例子表征"], "preconditions": ["已讨论一个具体例子"], "postconditions": ["直观与形式定义建立对应"], "failure_transition": "skill_concrete_example_bridge", "max_repeat": 2, "addition_reason": "neural-v1 phase 4 与 intuition_to_formalization 策略"},
      "source": {"origin": "operational_wrapper_from_neural_v1_provisional_ontology", "general_skill_id": "evidence_grounded_multimodal_teaching_neural_v1", "source_phase_ids": ["abstract_concept_building"], "source_strategy_ids": ["intuition_to_formalization", "line_by_line_explanation"], "observed_status": "provisional_normative_not_observed_consensus"}
    },
    {
      "skill_id": "skill_stepwise_scaffolding",
      "name": "逐步支架推导",
      "role": "scaffolding",
      "focus_dimension": "procedural",
      "base_priority": 16,
      "applicable_signals": ["partial", "correct", "confused"],
      "supporting_skill_ids": ["skill_minimal_hint", "skill_wait_and_elicit"],
      "selection_rationale": "把复杂操作拆成可检查的微步骤，每轮只推进一步。",
      "message_template": "请用 {concept} 处理：{practice}。先只说明第一步需要的输入、操作和输出。",
      "expected_signal": "学生能解释当前微步骤的依据，而不是只报最终答案。",
      "action_type": "guide_one_micro_step",
      "direct_answer_prohibited": true,
      "execution_contract": {"applicable_when": "概念基本理解但操作过程不稳", "contraindications": ["存在尚未处理的高置信概念误解"], "preconditions": ["有目标练习"], "postconditions": ["完成一个可验证微步骤"], "failure_transition": "skill_minimal_hint", "max_repeat": 3, "addition_reason": "neural-v1 phase 5 与 step_by_step 策略"},
      "source": {"origin": "operational_wrapper_from_neural_v1_provisional_ontology", "general_skill_id": "evidence_grounded_multimodal_teaching_neural_v1", "source_phase_ids": ["derivation_or_operation_walkthrough"], "source_strategy_ids": ["step_by_step", "line_by_line_explanation"], "observed_status": "provisional_normative_not_observed_consensus"}
    },
    {
      "skill_id": "skill_socratic_understanding_check",
      "name": "苏格拉底理解检查",
      "role": "assessment",
      "focus_dimension": "conceptual",
      "base_priority": 14,
      "applicable_signals": ["correct", "partial", "confused"],
      "supporting_skill_ids": ["skill_wait_and_elicit"],
      "selection_rationale": "通过理由、反例和边界追问检查理解，而不是只检查答案。",
      "message_template": "关于 {concept}，如果把当前条件改变一项，结论还成立吗？请先说明依据，再给一个反例或边界。",
      "expected_signal": "学生能解释依据并识别至少一个适用边界。",
      "action_type": "socratic_comprehension_probe",
      "direct_answer_prohibited": true,
      "execution_contract": {"applicable_when": "学生给出答案但理解深度尚不确定", "contraindications": ["学生当前无回应且需先恢复参与"], "preconditions": ["已有一个学生主张"], "postconditions": ["得到理由或边界证据"], "failure_transition": "skill_concrete_example_bridge", "max_repeat": 2, "addition_reason": "补齐 neural-v1 phase 6 与 socratic_followup 策略"},
      "source": {"origin": "operational_wrapper_from_neural_v1_provisional_ontology", "general_skill_id": "evidence_grounded_multimodal_teaching_neural_v1", "source_phase_ids": ["understanding_check"], "source_strategy_ids": ["socratic_followup", "question_and_wait"], "observed_status": "provisional_normative_not_observed_consensus"}
    },
    {
      "skill_id": "skill_misconception_contrast",
      "name": "误解对比纠错",
      "role": "correction",
      "focus_dimension": "conceptual",
      "base_priority": 12,
      "applicable_signals": ["misconception"],
      "supporting_skill_ids": ["skill_wait_and_elicit", "skill_confidence_support"],
      "selection_rationale": "定位错误的第一处失效条件，指导学生自我纠正。",
      "message_template": "你对 {concept} 的回答可能含有这个误解：“{misconception}”。请比较两种说法，指出第一处不成立的位置。",
      "expected_signal": "学生能定位错误并说出被忽略或混淆的条件。",
      "action_type": "guide_self_correction",
      "direct_answer_prohibited": true,
      "execution_contract": {"applicable_when": "存在有文本证据的明确误解", "contraindications": ["只有低置信困惑而没有具体错误"], "preconditions": ["误解 tag 和证据已记录"], "postconditions": ["按 tag 更新误解生命周期"], "failure_transition": "skill_concrete_example_bridge", "max_repeat": 2, "addition_reason": "neural-v1 phase 7 与 error_correction/contrastive_learning 策略"},
      "source": {"origin": "operational_wrapper_from_neural_v1_provisional_ontology", "general_skill_id": "evidence_grounded_multimodal_teaching_neural_v1", "source_phase_ids": ["error_diagnosis_and_correction"], "source_strategy_ids": ["error_correction", "contrastive_learning"], "observed_status": "provisional_normative_not_observed_consensus"}
    },
    {
      "skill_id": "skill_practice_feedback",
      "name": "练习—反馈—再练习",
      "role": "practice",
      "focus_dimension": "procedural",
      "base_priority": 17,
      "applicable_signals": ["correct", "partial"],
      "supporting_skill_ids": ["skill_minimal_hint"],
      "selection_rationale": "用单一关键点练习检验操作，并只反馈第一处需要修改的位置。",
      "message_template": "请独立完成只考查 {concept} 关键步骤的练习：{practice}。写出依据，我只反馈第一处问题。",
      "expected_signal": "学生完成关键步骤并能根据局部反馈修订。",
      "action_type": "targeted_practice_feedback",
      "direct_answer_prohibited": true,